[
  {
    "TCode": "9KZYX5ZZ",
    "TUMOUR_ID": "T00014",
    "DIAGNOSIS_DATE_SHIFTED": "2001-05-19T00:00:00",
    "DIAGNOSIS_YEAR": 2001,
    "AGE_AT_DIAGNOSIS": 43,
    "ICD_CODE": "C50.9",
    "MORPH_CODE": "8500/3",
    "CANCER_SITE": "Breast",
    "GROUPED_SITE": "Breast",
    "GRADE": "G3",
    "TUMOUR_SIZE": 31.2,
    "STAGE": "II",
    "LATERALITY": "L",
    "T_STAGE": "T1",
    "N_STAGE": "N0",
    "M_STAGE": "M0",
    "ER_STATUS": "Positive",
    "PR_STATUS": "Negative",
    "HER2_STATUS": "Negative",
    "HER2_FISH": null,
    "Ki67": null,
    "SCREEN_DETECTED": 0
  },
  {
    "TCode": "04JCRW9A",
    "TUMOUR_ID": "T00036",
    "DIAGNOSIS_DATE_SHIFTED": "2020-08-01T00:00:00",
    "DIAGNOSIS_YEAR": 2020,
    "AGE_AT_DIAGNOSIS": 50,
    "ICD_CODE": "C50.4",
    "MORPH_CODE": "8500/3",
    "CANCER_SITE": "Breast",
    "GROUPED_SITE": "Breast",
    "GRADE": "G2",
    "TUMOUR_SIZE": 23.2,
    "STAGE": "II",
    "LATERALITY": "L",
    "T_STAGE": "T2",
    "N_STAGE": "N0",
    "M_STAGE": "M0",
    "ER_STATUS": "Positive",
    "PR_STATUS": "Unknown",
    "HER2_STATUS": "Negative",
    "HER2_FISH": null,
    "Ki67": null,
    "SCREEN_DETECTED": 0
  },
  {
    "TCode": "XF32VD18",
    "TUMOUR_ID": "T00108",
    "DIAGNOSIS_DATE_SHIFTED": "2016-05-17T00:00:00",
    "DIAGNOSIS_YEAR": 2016,
    "AGE_AT_DIAGNOSIS": 65,
    "ICD_CODE": "C50.8",
    "MORPH_CODE": "8500/3",
    "CANCER_SITE": "Breast",
    "GROUPED_SITE": "Breast",
    "GRADE": "G3",
    "TUMOUR_SIZE": 11.8,
    "STAGE": "III",
    "LATERALITY": "R",
    "T_STAGE": "T2",
    "N_STAGE": "N2",
    "M_STAGE": "M0",
    "ER_STATUS": "Positive",
    "PR_STATUS": "Positive",
    "HER2_STATUS": "Negative",
    "HER2_FISH": null,
    "Ki67": 16.7,
    "SCREEN_DETECTED": 0
  },
  {
    "TCode": "NERGWJ8R",
    "TUMOUR_ID": "T00152",
    "DIAGNOSIS_DATE_SHIFTED": "2013-04-25T00:00:00",
    "DIAGNOSIS_YEAR": 2013,
    "AGE_AT_DIAGNOSIS": 57,
    "ICD_CODE": "C57.0",
    "MORPH_CODE": "8460/3",
    "CANCER_SITE": "Ovary",
    "GROUPED_SITE": "Ovary",
    "GRADE": "G2",
    "TUMOUR_SIZE": 21.8,
    "STAGE": "I",
    "LATERALITY": "L",
    "T_STAGE": "T1b",
    "N_STAGE": "N0",
    "M_STAGE": "M0",
    "ER_STATUS": null,
    "PR_STATUS": null,
    "HER2_STATUS": null,
    "HER2_FISH": null,
    "Ki67": null,
    "SCREEN_DETECTED": null
  },
  {
    "TCode": "Y48T5MHR",
    "TUMOUR_ID": "T00183",
    "DIAGNOSIS_DATE_SHIFTED": "2009-08-23T00:00:00",
    "DIAGNOSIS_YEAR": 2009,
    "AGE_AT_DIAGNOSIS": 60,
    "ICD_CODE": "C50.4",
    "MORPH_CODE": "8500/3",
    "CANCER_SITE": "Breast",
    "GROUPED_SITE": "Breast",
    "GRADE": "G2",
    "TUMOUR_SIZE": 11.9,
    "STAGE": "IV",
    "LATERALITY": "R",
    "T_STAGE": "T3",
    "N_STAGE": "N3",
    "M_STAGE": "M1",
    "ER_STATUS": "Positive",
    "PR_STATUS": "Positive",
    "HER2_STATUS": "Negative",
    "HER2_FISH": null,
    "Ki67": 28.3,
    "SCREEN_DETECTED": 0
  },
  {
    "TCode": "PUUKBI7I",
    "TUMOUR_ID": "T00024",
    "DIAGNOSIS_DATE_SHIFTED": "2020-09-15T00:00:00",
    "DIAGNOSIS_YEAR": 2020,
    "AGE_AT_DIAGNOSIS": 63,
    "ICD_CODE": "C50.2",
    "MORPH_CODE": "8500/3",
    "CANCER_SITE": "Breast",
    "GROUPED_SITE": "Breast",
    "GRADE": "G2",
    "TUMOUR_SIZE": 28.1,
    "STAGE": "II",
    "LATERALITY": "R",
    "T_STAGE": "T2",
    "N_STAGE": "N0",
    "M_STAGE": "M0",
    "ER_STATUS": "Positive",
    "PR_STATUS": "Negative",
    "HER2_STATUS": "Negative",
    "HER2_FISH": null,
    "Ki67": 18.5,
    "SCREEN_DETECTED": 0
  },
  {
    "TCode": "R07N8VOE",
    "TUMOUR_ID": "T00175",
    "DIAGNOSIS_DATE_SHIFTED": "2015-03-23T00:00:00",
    "DIAGNOSIS_YEAR": 2015,
    "AGE_AT_DIAGNOSIS": 50,
    "ICD_CODE": "C50.2",
    "MORPH_CODE": "8500/3",
    "CANCER_SITE": "Breast",
    "GROUPED_SITE": "Breast",
    "GRADE": "G3",
    "TUMOUR_SIZE": 11.3,
    "STAGE": "I",
    "LATERALITY": "L",
    "T_STAGE": "T1a",
    "N_STAGE": "N0",
    "M_STAGE": "M0",
    "ER_STATUS": "Positive",
    "PR_STATUS": "Positive",
    "HER2_STATUS": "Negative",
    "HER2_FISH": null,
    "Ki67": 16.5,
    "SCREEN_DETECTED": 0
  },
  {
    "TCode": "CMXZYRJF",
    "TUMOUR_ID": "T00107",
    "DIAGNOSIS_DATE_SHIFTED": "2013-04-19T00:00:00",
    "DIAGNOSIS_YEAR": 2013,
    "AGE_AT_DIAGNOSIS": 56,
    "ICD_CODE": "C50.4",
    "MORPH_CODE": "8500/3",
    "CANCER_SITE": "Breast",
    "GROUPED_SITE": "Breast",
    "GRADE": "G1",
    "TUMOUR_SIZE": 26.6,
    "STAGE": "IV",
    "LATERALITY": "R",
    "T_STAGE": "T4",
    "N_STAGE": "N2",
    "M_STAGE": null,
    "ER_STATUS": "Positive",
    "PR_STATUS": "Negative",
    "HER2_STATUS": "Negative",
    "HER2_FISH": null,
    "Ki67": 13.6,
    "SCREEN_DETECTED": 0
  },
  {
    "TCode": "MQ0NJVJP",
    "TUMOUR_ID": "T00141",
    "DIAGNOSIS_DATE_SHIFTED": "2019-03-03T00:00:00",
    "DIAGNOSIS_YEAR": 2019,
    "AGE_AT_DIAGNOSIS": 63,
    "ICD_CODE": "C50.3",
    "MORPH_CODE": "8500/3",
    "CANCER_SITE": "Breast",
    "GROUPED_SITE": "Breast",
    "GRADE": "G1",
    "TUMOUR_SIZE": 30.5,
    "STAGE": "III",
    "LATERALITY": "R",
    "T_STAGE": "T4",
    "N_STAGE": "N2",
    "M_STAGE": "M0",
    "ER_STATUS": "Positive",
    "PR_STATUS": "Negative",
    "HER2_STATUS": "Negative",
    "HER2_FISH": null,
    "Ki67": 7.2,
    "SCREEN_DETECTED": 1
  },
  {
    "TCode": "9NG32D0E",
    "TUMOUR_ID": "T00198",
    "DIAGNOSIS_DATE_SHIFTED": "2010-12-06T00:00:00",
    "DIAGNOSIS_YEAR": 2010,
    "AGE_AT_DIAGNOSIS": 43,
    "ICD_CODE": "C50.4",
    "MORPH_CODE": "8500/3",
    "CANCER_SITE": "Breast",
    "GROUPED_SITE": "Breast",
    "GRADE": "G2",
    "TUMOUR_SIZE": null,
    "STAGE": "I",
    "LATERALITY": "L",
    "T_STAGE": "T1c",
    "N_STAGE": "N0",
    "M_STAGE": "M0",
    "ER_STATUS": "Positive",
    "PR_STATUS": "Positive",
    "HER2_STATUS": "Negative",
    "HER2_FISH": null,
    "Ki67": null,
    "SCREEN_DETECTED": 0
  },
  {
    "TCode": "TM4RN5HO",
    "TUMOUR_ID": "T00219",
    "DIAGNOSIS_DATE_SHIFTED": "2008-03-02T00:00:00",
    "DIAGNOSIS_YEAR": 2008,
    "AGE_AT_DIAGNOSIS": 47,
    "ICD_CODE": "C19",
    "MORPH_CODE": "8140/3",
    "CANCER_SITE": "Colon/Rectum",
    "GROUPED_SITE": "Colorectum",
    "GRADE": null,
    "TUMOUR_SIZE": null,
    "STAGE": "II",
    "LATERALITY": "M",
    "T_STAGE": "T2",
    "N_STAGE": "N0",
    "M_STAGE": "M0",
    "ER_STATUS": null,
    "PR_STATUS": null,
    "HER2_STATUS": null,
    "HER2_FISH": null,
    "Ki67": null,
    "SCREEN_DETECTED": null
  },
  {
    "TCode": "COSKPSCE",
    "TUMOUR_ID": "T00187",
    "DIAGNOSIS_DATE_SHIFTED": "2021-08-05T00:00:00",
    "DIAGNOSIS_YEAR": 2021,
    "AGE_AT_DIAGNOSIS": 52,
    "ICD_CODE": "C50.4",
    "MORPH_CODE": "8500/3",
    "CANCER_SITE": "Breast",
    "GROUPED_SITE": "Breast",
    "GRADE": "GX",
    "TUMOUR_SIZE": 42.1,
    "STAGE": "III",
    "LATERALITY": "L",
    "T_STAGE": "T2",
    "N_STAGE": "N1",
    "M_STAGE": "M0",
    "ER_STATUS": "Unknown",
    "PR_STATUS": "Negative",
    "HER2_STATUS": "Negative",
    "HER2_FISH": null,
    "Ki67": 7.3,
    "SCREEN_DETECTED": 1
  },
  {
    "TCode": "XBT6HMRY",
    "TUMOUR_ID": "T00119",
    "DIAGNOSIS_DATE_SHIFTED": "1998-07-28T00:00:00",
    "DIAGNOSIS_YEAR": 1998,
    "AGE_AT_DIAGNOSIS": 62,
    "ICD_CODE": "C50.8",
    "MORPH_CODE": "8480/3",
    "CANCER_SITE": "Breast",
    "GROUPED_SITE": "Breast",
    "GRADE": "G1",
    "TUMOUR_SIZE": 11.9,
    "STAGE": "III",
    "LATERALITY": "R",
    "T_STAGE": "T4",
    "N_STAGE": "N2",
    "M_STAGE": "M0",
    "ER_STATUS": "Positive",
    "PR_STATUS": "Positive",
    "HER2_STATUS": "Positive",
    "HER2_FISH": null,
    "Ki67": 27.9,
    "SCREEN_DETECTED": 0
  },
  {
    "TCode": "HJN11O5L",
    "TUMOUR_ID": "T00217",
    "DIAGNOSIS_DATE_SHIFTED": "2014-03-11T00:00:00",
    "DIAGNOSIS_YEAR": 2014,
    "AGE_AT_DIAGNOSIS": 80,
    "ICD_CODE": "C50.8",
    "MORPH_CODE": "8500/3",
    "CANCER_SITE": "Breast",
    "GROUPED_SITE": "Breast",
    "GRADE": "G2",
    "TUMOUR_SIZE": 33.0,
    "STAGE": "II",
    "LATERALITY": "R",
    "T_STAGE": "T2",
    "N_STAGE": "N1",
    "M_STAGE": "M0",
    "ER_STATUS": "Negative",
    "PR_STATUS": "Positive",
    "HER2_STATUS": "Negative",
    "HER2_FISH": null,
    "Ki67": 13.7,
    "SCREEN_DETECTED": 1
  },
  {
    "TCode": "F5JCDZ93",
    "TUMOUR_ID": "T00040",
    "DIAGNOSIS_DATE_SHIFTED": "2017-12-01T00:00:00",
    "DIAGNOSIS_YEAR": 2017,
    "AGE_AT_DIAGNOSIS": 75,
    "ICD_CODE": "C50.5",
    "MORPH_CODE": "8510/3",
    "CANCER_SITE": "Breast",
    "GROUPED_SITE": "Breast",
    "GRADE": "G3",
    "TUMOUR_SIZE": 16.3,
    "STAGE": "I",
    "LATERALITY": "R",
    "T_STAGE": "T1b",
    "N_STAGE": "N0",
    "M_STAGE": "M0",
    "ER_STATUS": "Positive",
    "PR_STATUS": "Positive",
    "HER2_STATUS": "Borderline",
    "HER2_FISH": "Positive",
    "Ki67": 30.2,
    "SCREEN_DETECTED": 0
  },
  {
    "TCode": "6LUU6IF3",
    "TUMOUR_ID": "T00049",
    "DIAGNOSIS_DATE_SHIFTED": "2015-11-22T00:00:00",
    "DIAGNOSIS_YEAR": 2015,
    "AGE_AT_DIAGNOSIS": 64,
    "ICD_CODE": "C50.8",
    "MORPH_CODE": "8510/3",
    "CANCER_SITE": "Breast",
    "GROUPED_SITE": "Breast",
    "GRADE": null,
    "TUMOUR_SIZE": 9.8,
    "STAGE": "X",
    "LATERALITY": "L",
    "T_STAGE": "TX",
    "N_STAGE": "NX",
    "M_STAGE": "MX",
    "ER_STATUS": "Positive",
    "PR_STATUS": "Positive",
    "HER2_STATUS": "Unknown",
    "HER2_FISH": null,
    "Ki67": 29.0,
    "SCREEN_DETECTED": 1
  },
  {
    "TCode": "XVEUAA2U",
    "TUMOUR_ID": "T00197",
    "DIAGNOSIS_DATE_SHIFTED": "2006-08-27T00:00:00",
    "DIAGNOSIS_YEAR": 2006,
    "AGE_AT_DIAGNOSIS": 54,
    "ICD_CODE": "C20",
    "MORPH_CODE": "8140/3",
    "CANCER_SITE": "Colon/Rectum",
    "GROUPED_SITE": "Colorectum",
    "GRADE": null,
    "TUMOUR_SIZE": null,
    "STAGE": "II",
    "LATERALITY": "M",
    "T_STAGE": "T1",
    "N_STAGE": "N1",
    "M_STAGE": "M0",
    "ER_STATUS": null,
    "PR_STATUS": null,
    "HER2_STATUS": null,
    "HER2_FISH": null,
    "Ki67": null,
    "SCREEN_DETECTED": null
  },
  {
    "TCode": "NK3V4Q5B",
    "TUMOUR_ID": "T00101",